job_id,title,company,description,url,fetched_at
4282332923,"Data Scientist, Product",Notion,"About Us Notion helps you build beautiful tools for your life’s work. In today's world of endless apps and tabs, Notion provides one place for teams to get everything done, seamlessly connecting docs, notes, projects, calendar, and email—with AI built in to find answers and automate work. Millions of users, from individuals to large organizations like Toyota, Figma, and OpenAI, love Notion for its flexibility and choose it because it helps them save time and money. In-person collaboration is essential to Notion's culture. We require all team members to work from our offices on Mondays and Thursdays, our designated Anchor Days. Certain teams or positions may require additional in-office workdays. About The Role Notion’s mission is to make toolmaking ubiquitous. We are rapidly growing our business to empower every individual to build their own tools, block by block. Truth-seeking is one of Notion’s values, and it lies at the heart of the product data science team’s foundation. Data scientists on this team work closely with engineering teams to transform data into evidence that can direct product decisions. As an member of the product data science team, you'll be instrumental in setting the roadmap for how product, engineering, and data science work together, and then doing the hands on work to execute against it. There will be significant variation from one day to the next, but whether you're exploring what a successful Notion account looks like, analyzing user behavior on a feature to identify areas of improvement, or running experiments to evaluate the success of a key feature launch, you'll absolutely impact the development of Notion. What You'll Achieve You will apply your expertise in statistical inference, data analysis, and the presentation of data to see beyond the numbers and understand how our users interact with Notion You will dive into ambiguous areas, define problems and opportunities for the team to work on the next influential project You'll design the right set of experiments or analyses to evaluate the success of new features You'll partner closely with a product, engineering, and marketing pillar at every step of the development process, driving forward data science and analytics work in that area. You'll work with your teams to determine both north star and operational metrics, and build and maintain the dashboards that those teams rely on for monitoring progress and making key decisions. You'll influence your product roadmap by communicating your findings with the rest of the company, and driving and verifying change in our product and business. (Insights are useful. Impact is even better!) Skills You'll Need To Bring You have spent meaningful time as a data scientist partnering with product and engineering teams. You can draw on that experience to identify where data can have the most impact and clearly communicate to your partner teams what that impact is. You have expertise in SQL and at least one scripting language (ideally Python or R). You know how to use statistical inference and experimentation to drive actionable recommendations. You have experience building predictive models, and you know how to evaluate their effectiveness. You are comfortable transforming raw data to build your own data sets if the measure you need doesn't exist yet. You have a bias for using the right tools to get a job done with maximum efficiency. You have experience making tradeoffs between speed and accuracy. We hire talented and passionate people from a variety of backgrounds because we want our global employee base to represent the wide diversity of our customers. If you’re excited about a role but your past experience doesn’t align perfectly with every bullet point listed in the job description, we still encourage you to apply. If you’re a builder at heart, share our company values, and enthusiastic about making software toolmaking ubiquitous, we want to hear from you. Notion is proud to be an equal opportunity employer. We do not discriminate in hiring or any employment decision based on race, color, religion, national origin, age, sex (including pregnancy, childbirth, or related medical conditions), marital status, ancestry, physical or mental disability, genetic information, veteran status, gender identity or expression, sexual orientation, or other applicable legally protected characteristic. Notion considers qualified applicants with criminal histories, consistent with applicable federal, state and local law. Notion is also committed to providing reasonable accommodations for qualified individuals with disabilities and disabled veterans in our job application procedures. If you need assistance or an accommodation due to a disability, please let your recruiter know. Notion is committed to providing highly competitive cash compensation, equity, and benefits. The compensation offered for this role will be based on multiple factors such as location, the role’s scope and complexity, and the candidate’s experience and expertise, and may vary from the range provided below. For roles based in San Francisco or New York City, the estimated base salary range for this role is $140,000 - $170,000 per year. By clicking “Submit Application”, I understand and agree that Notion and its affiliates and subsidiaries will collect and process my information in accordance with Notion’s Global Recruiting Privacy Policy.",https://www.linkedin.com/jobs/view/4282332923,2025-10-14 02:56:03
4282338452,"Data Scientist, Product",Notion,"About Us Notion helps you build beautiful tools for your life’s work. In today's world of endless apps and tabs, Notion provides one place for teams to get everything done, seamlessly connecting docs, notes, projects, calendar, and email—with AI built in to find answers and automate work. Millions of users, from individuals to large organizations like Toyota, Figma, and OpenAI, love Notion for its flexibility and choose it because it helps them save time and money. In-person collaboration is essential to Notion's culture. We require all team members to work from our offices on Mondays and Thursdays, our designated Anchor Days. Certain teams or positions may require additional in-office workdays. About The Role Notion’s mission is to make toolmaking ubiquitous. We are rapidly growing our business to empower every individual to build their own tools, block by block. Truth-seeking is one of Notion’s values, and it lies at the heart of the product data science team’s foundation. Data scientists on this team work closely with engineering teams to transform data into evidence that can direct product decisions. As an member of the product data science team, you'll be instrumental in setting the roadmap for how product, engineering, and data science work together, and then doing the hands on work to execute against it. There will be significant variation from one day to the next, but whether you're exploring what a successful Notion account looks like, analyzing user behavior on a feature to identify areas of improvement, or running experiments to evaluate the success of a key feature launch, you'll absolutely impact the development of Notion. What You'll Achieve You will apply your expertise in statistical inference, data analysis, and the presentation of data to see beyond the numbers and understand how our users interact with Notion You will dive into ambiguous areas, define problems and opportunities for the team to work on the next influential project You'll design the right set of experiments or analyses to evaluate the success of new features You'll partner closely with a product, engineering, and marketing pillar at every step of the development process, driving forward data science and analytics work in that area. You'll work with your teams to determine both north star and operational metrics, and build and maintain the dashboards that those teams rely on for monitoring progress and making key decisions. You'll influence your product roadmap by communicating your findings with the rest of the company, and driving and verifying change in our product and business. (Insights are useful. Impact is even better!) Skills You'll Need To Bring You have spent meaningful time as a data scientist partnering with product and engineering teams. You can draw on that experience to identify where data can have the most impact and clearly communicate to your partner teams what that impact is. You have expertise in SQL and at least one scripting language (ideally Python or R). You know how to use statistical inference and experimentation to drive actionable recommendations. You have experience building predictive models, and you know how to evaluate their effectiveness. You are comfortable transforming raw data to build your own data sets if the measure you need doesn't exist yet. You have a bias for using the right tools to get a job done with maximum efficiency. You have experience making tradeoffs between speed and accuracy. We hire talented and passionate people from a variety of backgrounds because we want our global employee base to represent the wide diversity of our customers. If you’re excited about a role but your past experience doesn’t align perfectly with every bullet point listed in the job description, we still encourage you to apply. If you’re a builder at heart, share our company values, and enthusiastic about making software toolmaking ubiquitous, we want to hear from you. Notion is proud to be an equal opportunity employer. We do not discriminate in hiring or any employment decision based on race, color, religion, national origin, age, sex (including pregnancy, childbirth, or related medical conditions), marital status, ancestry, physical or mental disability, genetic information, veteran status, gender identity or expression, sexual orientation, or other applicable legally protected characteristic. Notion considers qualified applicants with criminal histories, consistent with applicable federal, state and local law. Notion is also committed to providing reasonable accommodations for qualified individuals with disabilities and disabled veterans in our job application procedures. If you need assistance or an accommodation due to a disability, please let your recruiter know. Notion is committed to providing highly competitive cash compensation, equity, and benefits. The compensation offered for this role will be based on multiple factors such as location, the role’s scope and complexity, and the candidate’s experience and expertise, and may vary from the range provided below. For roles based in San Francisco or New York City, the estimated base salary range for this role is $140,000 - $170,000 per year. By clicking “Submit Application”, I understand and agree that Notion and its affiliates and subsidiaries will collect and process my information in accordance with Notion’s Global Recruiting Privacy Policy.",https://www.linkedin.com/jobs/view/4282338452,2025-10-14 02:56:04
4313197449,"Data Scientist, Data & Analytics – Customer, Loyalty & Marketing",Circle K,"JOIN OUR TEAM! At Circle K, our mission is simple: to make our customers’ lives a little easier every day. You may have already stopped for coffee, refueling your car, or eating something on the go. Then, you know what Circle K is. Since the opening of a first store in Laval, Québec, our parent company, Alimentation Couche-Tard has never ceased to grow. We have grown into a successful global company with over 16,800 stores in 31 countries, serving almost 9 million customers every day. In total, more than 149,000 people work in our stores and offices. We make journeys easier by offering fast and friendly service. We care about our people and our communities, and we look for ways to uplift people first. Wherever your journey’s going, we can help you get there. Are you ready to grow your career? Let's grow together! THE ROLE As part of the Global Data & Analytics Team, we are seeking a skilled and business-savvy Data Scientist focusing on Marketing Analytics and Marketing Mix Modeling (MMM). This role will play a critical part in helping us understand and optimize the impact of our marketing investments across various channels (TV, digital, social, search, retail, etc.). The candidate will work closely with Marketing, Finance, and Data teams to deliver data-driven insights that drive strategic and tactical decision-making. He should have hands-on experience building MMMs, interpreting results for business stakeholders, and integrating those insights into actionable marketing recommendations. What You’ll Do Develop and maintain Marketing Mix Models to measure effectiveness of TV, radio, digital, out-of-home, print, and in-store promotions. Translate complex statistical outputs into clear, actionable insights for Marketing, Finance, and Leadership teams. Build in-house models using Python/R/other languages. Conduct scenario simulations and budget allocation optimization. Monitor data pipelines and ensure data quality and granularity (sales, media spend, promotions, weather, seasonality, store traffic). Contribute to broader analytics strategy, including incrementality testing, geo-experiments, and attribution modeling. Facilitate best practice sharing and contribute to automation and improvement of existing processes. Present actionable insights and recommendations to marketing business managers to influence business strategies and continuously enhance the value generation from loyalty programs. What You’ll Need Bachelor’s or Master’s degree in a quantitative field (e.g., Statistics, Data Science, Economics, Applied Mathematics, Computer Science). 3+ years’ experience in MMM, econometrics, or media effectiveness analysis. Strong background in statistics/econometrics (e.g., linear regression, time series, Bayesian models). Proficient in data wrangling and visualization using tools like Pandas, SQL, Power BI, or Tableau. Proficiency in query processing languages such as SQL and PySpark, along with hands-on experience on cloud-based platforms (e.g., Azure). Excellent communication skills with the ability to clearly articulate technical information to all levels of the organization and collaborate effectively with cross-functional teams. Strong stakeholder management skills, with experience engaging diverse teams and senior leaders across geographies. Collaborative and proactive, with the initiative to drive projects to successful completion. Adaptable to new and evolving technologies and business needs. Curious and committed to continuous learning in both business and technology domain. Circle K is an Equal Opportunity Employer. The Company complies with the Americans with Disabilities Act (the ADA) and all state and local disability laws. Applicants with disabilities may be entitled to a reasonable accommodation under the terms of the ADA and certain state or local laws as long as it does not impose an undue hardship on the Company. Please inform the Company’s Human Resources Representative if you need assistance completing any forms or to otherwise participate in the application process. Click below to review information about our company's use of the federal E-Verify program to check work eligibility: In English In Spanish",https://www.linkedin.com/jobs/view/4313197449,2025-10-14 02:56:06
4301496277,"Data Scientist, Product Analytics",Meta,"As a Data Scientist at Meta, you will shape the future of people-facing and business-facing products we build across our entire family of applications (Facebook, Instagram, Messenger, WhatsApp, Oculus). By applying your technical skills, analytical mindset, and product intuition to one of the richest data sets in the world, you will help define the experiences we build for billions of people and hundreds of millions of businesses around the world. You will collaborate on a wide array of product and business problems with a wide-range of cross-functional partners across Product, Engineering, Research, Data Engineering, Marketing, Sales, Finance and others. You will use data and analysis to identify and solve product development's biggest challenges. You will influence product strategy and investment decisions with data, be focused on impact, and collaborate with other teams. By joining Meta, you will become part of a world-class analytics community dedicated to skill development and career growth in analytics and beyond.Product leadership: You will use data to shape product development, quantify new opportunities, identify upcoming challenges, and ensure the products we build bring value to people, businesses, and Meta. You will help your partner teams prioritize what to build, set goals, and understand their product's ecosystem.Analytics: You will guide teams using data and insights. You will focus on developing hypotheses and employ a varied toolkit of rigorous analytical approaches, different methodologies, frameworks, and technical approaches to test them.Communication and influence: You won't simply present data, but tell data-driven stories. You will convince and influence your partners using clear insights and recommendations. You will build credibility through structure and clarity, and be a trusted strategic partner. Data Scientist, Product Analytics Responsibilities: Work with large and complex data sets to solve a wide array of challenging problems using different analytical and statistical approaches Apply technical expertise with quantitative analysis, experimentation, data mining, and the presentation of data to develop strategies for our products that serve billions of people and hundreds of millions of businesses Identify and measure success of product efforts through goal setting, forecasting, and monitoring of key product metrics to understand trends Define, understand, and test opportunities and levers to improve the product, and drive roadmaps through your insights and recommendations Partner with Product, Engineering, and cross-functional teams to inform, influence, support, and execute product strategy and investment decisions Minimum Qualifications: Currently has, or is in the process of obtaining a Bachelor's degree in Computer Science, Computer Engineering, relevant technical field, or equivalent practical experience. Degree must be completed prior to joining Meta Bachelor's degree in Mathematics, Statistics, a relevant technical field, or equivalent 2+ years of work experience in analytics and data querying languages (e.g. SQL), scripting languages (e.g. Python), and/or statistical/mathematical software (e.g. R) 2+ years of experience solving analytical problems using quantitative approaches, understanding ecosystems, user behaviors & long-term product trends, and leading data-driven projects from definition to execution [including defining metrics, experiment, design, communicating actionable insights] Preferred Qualifications: Master's or Ph.D. Degree in a quantitative field About Meta: Meta builds technologies that help people connect, find communities, and grow businesses. When Facebook launched in 2004, it changed the way people connect. Apps like Messenger, Instagram and WhatsApp further empowered billions around the world. Now, Meta is moving beyond 2D screens toward immersive experiences like augmented and virtual reality to help build the next evolution in social technology. People who choose to build their careers by building with us at Meta help shape a future that will take us beyond what digital connection makes possible today—beyond the constraints of screens, the limits of distance, and even the rules of physics. Meta is proud to be an Equal Employment Opportunity and Affirmative Action employer. We do not discriminate based upon race, religion, color, national origin, sex (including pregnancy, childbirth, or related medical conditions), sexual orientation, gender, gender identity, gender expression, transgender status, sexual stereotypes, age, status as a protected veteran, status as an individual with a disability, or other applicable legally protected characteristics. We also consider qualified applicants with criminal histories, consistent with applicable federal, state and local law. Meta participates in the E-Verify program in certain locations, as required by law. Please note that Meta may leverage artificial intelligence and machine learning technologies in connection with applications for employment. Meta is committed to providing reasonable accommodations for candidates with disabilities in our recruiting process. If you need any assistance or accommodations due to a disability, please let us know at accommodations-ext@fb.com. $114,000/year to $171,000/year + bonus + equity + benefits Individual compensation is determined by skills, qualifications, experience, and location. Compensation details listed in this posting reflect the base hourly rate, monthly rate, or annual salary only, and do not include bonus, equity or sales incentives, if applicable. In addition to base compensation, Meta offers benefits. Learn more about benefits at Meta.",https://www.linkedin.com/jobs/view/4301496277,2025-10-14 02:56:07
