job_id,title,company,description,url,fetched_at
4312791594,Data Scientist,inKind,"Job Title: Data Scientist Role Summary: As a Data Scientist at inKind, you will be responsible for gathering and analyzing large datasets, extracting actionable insights, and using those insights to drive predictive forecasts as well as automated and ad hoc business actions and decision making. You will work closely with our data team and cross-functional stakeholders including marketing, finance, and product, to deliver recommendations, and models that will drive decision-making, automated actions, innovation, and enhance platform performance. This role requires a strong technical background in SQL, Python, Snowflake (Cortex AI), data modeling, and ETL processes, along with a deep understanding of analytics best practices. Because of inKind's position as a fast growing start-up, this role will also require working with urgency and full commitment, and delivering solutions that drive large impacts at the platform level. Key Responsibilities Understanding - Develop a deep analytic understanding of inKind's product that will serve as the backbone for developing data-science driven models to innovate, automate, and optimize user acquisition, engagement, and profitability. In addition, thoroughly understand the qualitative context underlying inKind's historical data and macro business goals and take those factors into account within the data science process. Continuously validate assumptions through experimentation and real-world performance of models. Underlying Data - Gather data from various sources, then clean, combine, transform, and prepare for analysis, modeling, and forecasting. Design datasets for optimal feature engineering. Analysis - Analyze large datasets to uncover trends, patterns, and opportunities using statistical methods, predictive modeling, AI tools, and machine learning. Develop and refine models to improve forecasting and power both automated and ad hoc decision-making. Continually update and refine data models to drive better results. Results - Collaborate with cross-functional business teams including data, marketing, product, and finance to translate business needs into robust and actionable solutions. Develop and deploy automated, repeatable, and scalable data-driven actions and processes. Integrate outputs into bespoke tests, marketing campaigns and product workflows. Communication - Present findings, work product, and recommendations to both technical and non-technical stakeholders Systems - Work with cloud-based data warehouses (e.g., Snowflake, BigQuery, Redshift) and analytics tools (e.g., dbt, Sigma, Looker, Tableau) in addition to standing up a data science tool stack Minimum Qualifications: 3-5+ years of experience in data science, analytics engineering, data engineering, or related role Strong Python, SQL, R, and Snowflake Cortex AI experience Robust analytical abilities with the capacity to gather, arrange, and organize, a substantial amount of information with accuracy and attention to detail Understanding of data modeling principles (Kimball, Star Schema, etc.) Experience with supervised learning methods (Random Forest, Gradient Boosting, and regression models), including feature engineering and model evaluation Familiarity with BI tools like Sigma, Looker, Power BI, Tableau, or Mode Analytics. Strong problem-solving skills The ability to work cross-functionally and communicate effectively with technical and non-technical teams Passion for data-driven decision-making and improving business outcomes Must love restaurants and hospitality Preferred Qualifications: Bachelor's degree in computer science, data science, mathematics, information sciences, statistics or related field or equivalent work experience Experience with feature engineering and supervised learning models Experience building and maintaining ETL pipelines Previous startup experience Work Environment: The candidate in this position will be located in an office environment and be exposed to lighting, temperature, and noise level conditions typical of that environment This position is in-person, with an expectation of in-person work at the physical office location in downtown Austin, Texas Some of our Benefits: Generous PTO and company holiday policy + company paid Short Term Disability 100% employer covered health and dental insurance for our direct employees (a set plan is covered, with higher tier healthcare coverage available at employee's additional cost; dependent coverage is at employee's cost); vision plan available at employee's additional cost Child Care Benefits and generous parental leave Dog-friendly workspace in a secure building with great views of downtown Austin Daily lunches and snacks Salary : $120,000 - $140,000 DOE inKind is an Equal Opportunity Employer. We believe that diversity is vital to inKind's ability to provide our clients with the best recommendations and are committed to fostering a varied and inclusive work environment. Your race, color, ancestry, religion, gender, gender identity, national origin, sexual orientation, age, marital status, disability status, veteran status, or any other protected category have no bearing on our hiring decisions. Read our Privacy Policy.",https://www.linkedin.com/jobs/view/4312791594,2025-10-14 02:56:55
4314194647,Machine Learning Engineer,Poesis AI,"About The Role Poesis is building an AI-driven hedge fund focused on daily trading decisions, not high-frequency trading. We’re hiring our Founding ML Engineer, the first full-time machine learning hire who will turn research and data into production models. You’ll build the first ML pipelines end-to-end — from ingesting and cleaning data, to model training, validation, and daily signal generation. This is a deeply hands-on, execution-oriented role for someone who can write code, design experiments, and deliver validated results quickly. You’ll work directly with the CEO, CFO, and Chief Scientist, owning both implementation and iteration. Over time, you’ll help scale the system into a full production platform and define best practices for future hires. Location: San Francisco Bay Area (in-office; relocation available) Responsibilities Architect, build, and maintain the core ML infrastructure for Poesis’ investment platform. Develop reproducible pipelines for data ingestion, feature generation, and model training. Implement backtesting and evaluation frameworks with clear performance metrics. Deliver regular, documented reports on model accuracy, feature importance, and portfolio-level impact. Collaborate closely with the Chief Scientist to refine model hypotheses and production readiness. Maintain code quality: version control, testing, reproducibility, and documentation. Build robust backtesting frameworks and model validation tools with walk-forward evaluation and risk controls. Integrate with professional financial data providers (Bloomberg, FactSet, Refinitiv, CapIQ). Establish foundational MLOps practices: model versioning, CI/CD, monitoring, and documentation. Define and iterate on “demo-able” workflows that connect model outputs to investment decision-makers. Required Competencies 5–10+ years of experience as an ML Engineer, Quant Engineer, or similar role. Proven track record deploying production ML systems (ideally in finance or other high-stakes domains). Deep expertise in Python and ML frameworks (PyTorch, TensorFlow, scikit-learn, JAX, XGBoost). Experience designing large-scale, reliable data or MLOps systems. Strong software engineering fundamentals: testing, versioning, CI/CD, and code review discipline. Experience with financial data APIs and real-time data handling. Comfortable working directly with executives and acting as both IC and product owner. Willingness to work in-person in the Bay Area; relocation support available. Preferred Competencies Prior experience at a hedge fund, quant research lab, or fintech startup. Familiarity with quantitative finance, portfolio optimization, or risk management. Exposure to time-series modeling, forecasting, or reinforcement learning. Understanding of financial market microstructure and execution systems. Experience with LLM/RAG workflows for parsing financial documents (filings, transcripts). Comfort with multi-language engineering environments (C++, Rust, Go, etc.). Profile You’re a founder-type engineer — equally comfortable writing code, setting strategy, and defining requirements. You thrive in high-autonomy, low-process environments and like being close to decision-makers. You think like both a researcher and a builder, able to turn models into production systems quickly. You’re pragmatic: you deliver something useful fast, then refine it as data and users evolve. You want to build the technical backbone of a next-generation hedge fund from day one.",https://www.linkedin.com/jobs/view/4314194647,2025-10-14 02:56:57
4313987842,Data Scientist I- Windreich Department for Artificial Intelligence & Human Health,Lensa,"Lensa is a career site that helps job seekers find great jobs in the US. We are not a staffing firm or agency. Lensa does not hire directly for these jobs, but promotes jobs on LinkedIn on behalf of its direct clients, recruitment ad agencies, and marketing partners. Lensa partners with DirectEmployers to promote this job for Mount Sinai Health System. Clicking ""Apply Now"" or ""Read more"" on Lensa redirects you to the job board/employer site. Any information collected there is subject to their terms and privacy notice. Job Description We are seeking a skilled Data Scientist I to join our team in the SinAI Assurance Lab. The position will play a key role in Machine Learning Operations and be responsible for validation, monitoring, and governance of AI models across clinical workflows at the Mount Sinai Health System. This role will ensure that these models meet Mount Sinai’s high standards for safety, equity, and real-world performance. You will work in partnership with the AI Governance Committee, product owners, clinicians, Epic technical team, and DevOps teams to rigorously evaluate both Generative and Non-Generative AI tools before and after deployment. Qualifications Master's degree in a quantitative discipline (e.g., Statistics, Operations Research, Bioinformatics, Economics, Computational Biology, Computer Science, Information Technology, Mathematics, Physics) or equivalent practical experience. 2 years of work experience in data science, software engineering, or data analysis Experience with at least one programming language among Scala, Python, Java, C, or C++. Expert knowledge on Machine Learning Algorithms Proficiency in database languages (e.g., SQL, NoSQL) and cloud computing platforms (e.g., AWS, Azure, GCP) Proficiency in visualization tools like Plotly, Tableau, Power BI Familiarity with ML lifecycle management tools (e.g., MLflow, Kubeflow, Airflow) Experience with monitoring tools for AI model tracking Understanding of DevOps principles, CI/CD pipelines, and containerization (e.g., Docker, Kubernetes) Experience with version control systems (e.g., Git) Knowledge of big data technologies (e.g., Hadoop, Spark) Strong problem-solving skills and ability to work in cross-functional teams Responsibilities Core ML & Validation Curate, clean, and manage large complex datasets from various sources for modeling and analysis. Assist in designing, evaluating, and refining ML models, including performance benchmarking and fairness analysis. Develop and run model validation tests for robustness, accuracy, and generalizability across demographic subgroups. Collaborate on model QA and deployment workflows with engineering teams, ensuring models are safe and production ready. AI Product Governance Design validation protocols for AI models to ensure ethical use, bias mitigation, and regulatory compliance. Monitor deployed models for performance degradation, drift, and bias over time. Ensure auditability of all validation and monitoring outputs using standardized documentation practices. Assist in compliance workflows including traceability, re-validation, and version documentation of AI tools. Ensure products maintain expected performance in clinical settings by tracking model drift, bias, and data integrity issues Communication & Reporting Translate statistical and technical insights into accessible reports for clinicians, product managers, and governance bodies. Present results from AI validation testing and monitoring to stakeholders and contribute to institutional governance decisions. Maintain rigorous documentation on model performance, validation methods, and compliance actions. Stay current with emerging best practices in AI model development, validation, safety, transparency, and interpretability. About Us Strength through Unity and Inclusion The Mount Sinai Health System is committed to fostering an environment where everyone can contribute to excellence. We share a common dedication to delivering outstanding patient care. When you join us, you become part of Mount Sinai’s unparalleled legacy of achievement, education, and innovation as we work together to transform healthcare. We encourage all team members to actively participate in creating a culture that ensures fair access to opportunities, promotes inclusive practices, and supports the success of every individual. At Mount Sinai, our leaders are committed to fostering a workplace where all employees feel valued, respected, and empowered to grow. We strive to create an environment where collaboration, fairness, and continuous learning drive positive change, improving the well-being of our staff, patients, and organization. Our leaders are expected to challenge outdated practices, promote a culture of respect, and work toward meaningful improvements that enhance patient care and workplace experiences. We are dedicated to building a supportive and welcoming environment where everyone has the opportunity to thrive and advance professionally. Explore this opportunity and be part of the next chapter in our history. About The Mount Sinai Health System Mount Sinai Health System is one of the largest academic medical systems in the New York metro area, with more than 48,000 employees working across eight hospitals, more than 400 outpatient practices, more than 300 labs, a school of nursing, and a leading school of medicine and graduate education. Mount Sinai advances health for all people, everywhere, by taking on the most complex health care challenges of our time — discovering and applying new scientific learning and knowledge; developing safer, more effective treatments; educating the next generation of medical leaders and innovators; and supporting local communities by delivering high-quality care to all who need it. Through the integration of its hospitals, labs, and schools, Mount Sinai offers comprehensive health care solutions from birth through geriatrics, leveraging innovative approaches such as artificial intelligence and informatics while keeping patients’ medical and emotional needs at the center of all treatment. The Health System includes more than 9,000 primary and specialty care physicians; 13 joint-venture outpatient surgery centers throughout the five boroughs of New York City, Westchester, Long Island, and Florida; and more than 30 affiliated community health centers. We are consistently ranked by U.S. News & World Report's Best Hospitals, receiving high ""Honor Roll"" status, and are highly ranked: No. 1 in Geriatrics, top 5 in Cardiology/Heart Surgery, and top 20 in Diabetes/Endocrinology, Gastroenterology/GI Surgery, Neurology/Neurosurgery, Orthopedics, Pulmonology/Lung Surgery, Rehabilitation, and Urology. New York Eye and Ear Infirmary of Mount Sinai is ranked No. 12 in Ophthalmology. U.S. News & World Report’s “Best Children’s Hospitals” ranks Mount Sinai Kravis Children's Hospital among the country’s best in several pediatric specialties. The Icahn School of Medicine at Mount Sinai is ranked No. 11 nationwide in National Institutes of Health funding and in the 99th percentile in research dollars per investigator according to the Association of American Medical Colleges. Newsweek’s “The World’s Best Smart Hospitals” ranks The Mount Sinai Hospital as No. 1 in New York and in the top five globally, and Mount Sinai Morningside in the top 20 globally. Equal Opportunity Employer The Mount Sinai Health System is an equal opportunity employer, complying with all applicable federal civil rights laws. We do not discriminate, exclude, or treat individuals differently based on race, color, national origin, age, religion, disability, sex, sexual orientation, gender, veteran status, or any other characteristic protected by law. We are deeply committed to fostering an environment where all faculty, staff, students, trainees, patients, visitors, and the communities we serve feel respected and supported. Our goal is to create a healthcare and learning institution that actively works to remove barriers, address challenges, and promote fairness in all aspects of our organization. Compensation Statement Mount Sinai Health System (MSHS) provides a salary range to comply with the New York City Law on Salary Transparency in Job Advertisements. The salary range for the role is $109000 - $163695 Annually. Actual salaries depend on a variety of factors, including experience, education, and hospital need. The salary range or contractual rate listed does not include bonuses/incentive, differential pay or other forms of compensation or benefits. If you have questions about this posting, please contact support@lensa.com",https://www.linkedin.com/jobs/view/4313987842,2025-10-14 02:56:58
4310740201,Machine Learning Engineer,FanDuel,"THE POSITION Our roster has an opening with your name on it We’re looking for a Machine Learning Engineer to join our growing team and help design, build, and deploy machine learning systems that power real-world applications. In this role, you’ll work closely with data scientists, engineers, and product managers to bring models from experimentation to production and ensure they perform reliably at scale. You’ll contribute across the ML lifecycle—including feature engineering, model training, evaluation, deployment, and monitoring—while growing your skills in software development, ML Ops, and scalable infrastructure. If you’re excited by this challenge and want to work within a dynamic company, then we’d love to hear from you. In addition to the specific responsibilities outlined above, employees may be required to perform other such duties as assigned by the Company. This ensures operational flexibility and allows the Company to meet evolving business needs. THE GAME PLAN Everyone on our team has a part to play ML Pipeline Development Collaborate with data scientists to implement and optimize machine learning models for production use. Develop and maintain pipelines for data preparation, training, and model deployment. Build tools and services to support real-time and batch inference workloads. Collaboration & Execution Translate product and business requirements into ML-driven solutions. Participate in agile workflows, including sprint planning, code reviews, and design discussions. Work with engineers and analysts to ensure data integrity and efficient feature computation. Quality & Reliability Implement monitoring and alerting to track model performance and detect issues such as data drift. Write maintainable, testable code and follow best practices in version control and documentation. Help automate training, deployment, and retraining workflows using ML Ops tools. THE ST ACK : Databricks, AWS, Spark, Python, MLFlow, (Generally available ML Libraries), Terraform, Github, Buildkite THE STATS What we're looking for in our next teammate 2–4 years of experience in software engineering, machine learning, or data science. Proficiency in Python, with exposure to ML libraries (Scikit-learn, TensorFlow, or PyTorch). Solid understanding of data structures, algorithms, and software engineering principles. Hands-on with SQL and comfortable working with large datasets. Familiarity with distributed computing (Apache Spark preferred). Exposure to ML deployment & monitoring practices or strong interest in learning them. Bonus: experience with Databricks, MLflow, or similar ML Ops tools. Experience with cloud services (AWS preferred, GCP or Azure also valuable). Preferred Qualifications Experience with containerization (Docker, Kubernetes is a plus). Familiarity with orchestration/ML Ops tooling (SageMaker, MLflow). Understanding of model evaluation metrics and techniques for improving generalization. Interest in or experience with real-time ML systems, recommendation engines, or NLP. About You You might be a great fit if you often ask yourself questions like: “How do complex systems actually work end to end, and how can I make them better?” “What makes software reliable, and how do you design for that from the start?” “Where’s the balance between moving fast and building things that last?” “How do small changes in code or data ripple out into big user or business impacts?” “What can I automate today that will save everyone headaches tomorrow?” “How do different roles (engineers, data scientists, product managers, etc.) fit together to ship something meaningful?” “What skills should I grow next if I want to level up from strong engineer to strong ML engineer?” This role will join our Personalization team, working directly with senior engineers to: Build and optimize ML pipelines and feedback loops for our flagship recommender systems. Improve observability, monitoring, and on-call reliability across models. Partner with FinOps to optimize Spark jobs and cloud resource usage. Adopt and integrate AI Foundations platform tools into workflows. This person will have mentorship from Staff ICs and the opportunity to grow, directly contributing to the revenue-driving backbone of the company. About Fanduel FanDuel Group is the premier mobile gaming company in the United States and Canada. FanDuel Group consists of a portfolio of leading brands across mobile wagering including: America’s #1 Sportsbook, FanDuel Sportsbook; its leading iGaming platform, FanDuel Casino; the industry’s unquestioned leader in horse racing and advance-deposit wagering, FanDuel Racing; and its daily fantasy sports product. In addition, FanDuel Group operates FanDuel TV, its broadly distributed linear cable television network and FanDuel TV+, its leading direct-to-consumer OTT platform. FanDuel Group has a presence across all 50 states, Canada, and Puerto Rico. The company is based in New York with US offices in Los Angeles, Atlanta, and Jersey City, as well as global offices in Canada and Scotland. The company’s affiliates have offices worldwide, including in Ireland, Portugal, Romania, and Australia. FanDuel Group is a subsidiary of Flutter Entertainment, the world's largest sports betting and gaming operator with a portfolio of globally recognized brands and traded on the New York Stock Exchange (NYSE: FLUT). Player Benefits We treat our team right We offer amazing benefits above and beyond the basics. We have an array of health plans to choose from (some as low as $0 per paycheck) that include programs for fertility and family planning, mental health support, and fitness benefits. We offer generous paid time off (PTO & sick leave), annual bonus and long-term incentive opportunities (based on performance), 401k with up to a 5% match, commuter benefits , pet insurance, and more - check out all our benefits here: FanDuel Total Rewards . *Benefits differ across location, role, and level. FanDuel is an equal opportunities employer and we believe, as one of our principles states, “We are One Team!”. As such, we are committed to equal employment opportunity regardless of race, color, ethnicity, ancestry, religion, creed, sex, national origin, sexual orientation, age, citizenship status, marital status, disability, gender identity, gender expression, veteran status, or any other characteristic protected by state, local or federal law. We believe FanDuel is strongest and best able to compete if all employees feel valued, respected, and included. The applicable salary range for this position is $116,000 - $152,250 USD, which is dependent on a variety of factors including relevant experience, location, business needs and market demand. This role may offer the following benefits: medical, vision, and dental insurance; life insurance; disability insurance; a 401(k) matching program; among other employee benefits. This role may also be eligible for short-term or long-term incentive compensation, including, but not limited to, cash bonuses and stock program participation. This role includes paid personal time off and 14 paid company holidays. FanDuel offers paid sick time in accordance with all applicable state and federal laws. FanDuel is committed to providing reasonable accommodations for qualified individuals with disabilities. If you have a disability and need a workplace accommodation or adjustment during the application and hiring process, including support for the interview or onboarding process, please email Benefits@fanduel.com. It is unlawful in Massachusetts to require or administer a lie detector test as a condition of employment or continued employment. An employer who violates this law shall be subject to criminal penalties and civil liability.",https://www.linkedin.com/jobs/view/4310740201,2025-10-14 02:56:59
