job_id,title,company,description,url,fetched_at
4313278900,Data Scientist II,The Walt Disney Company,"The Subscriber & Commerce Data Science team at Disney Streaming builds Machine learning models to optimize payment processes, detect and prevent fraud, and forecast customer lifetime value across our streaming platforms, including Disney+, Hulu and ESPN+. We play a key role in growing the business by increasing payment success, reducing fraud, improving retention, and enabling value measurement through user-level lifetime value (LTV) modeling. We're hiring a Data Scientist to help design, build and deploy machine learning solutions that solve key business challenges. In this role, you’ll work closely with Product, Engineering, Analytics and Finance to deliver models that enhance the customer experience and drive measurable business impact. Responsibilities Machine Learning & Modeling Develop, optimize, and maintain models for payment optimization, fraud detection, and LTV prediction. Build robust end-to-end ML workflows, including data collection, feature engineering, model development, and evaluation. Experimentation & Deployment Collaborate with Product and Engineering to deploy models into production environments and monitor performance. Design and analyze A/B tests and other experiments to assess model impact. Implement batch and real-time inference pipelines for fraud detection and payment optimization use cases. Insights & Strategy Analyze subscriber behavior, payment flows, and fraud patterns to generate actionable insights. Translate complex data into clear, data-driven recommendations to improve business outcomes. Cross-functional Collaboration Partner with stakeholders to translate business needs into machine learning problems. Collaborate with Engineering to improve data pipelines, experimentation frameworks, and model monitoring. Communicate insights effectively to technical and non-technical stakeholders. Basic Qualifications Bachelor’s degree in Data Science, Computer Science, Statistics, Mathematics, or a related field. 3+ years of experience developing and deploying machine learning models in production. Proficiency in SQL, Python (e.g. Pandas, NumPy, Scikit-learn, LightGBM); experience with distributed computing tools such as Spark or PySpark. Preferred Qualifications M.S. or Ph.D. in a quantitative discipline Deep expertise in statistical modeling and machine learning, including Bayesian methods. Familiarity with tools like Databricks, Snowflake, Airflow, GitHub. Experience designing and analyzing A/B tests and other experiments. Experience with data visualization and exploration tools such as Tableau, Looker Ability to choose and justify appropriate modeling and statistical techniques for varied problems. Comfortable working in fast-paced environments with evolving priorities. Excellent communication skills with both technical and non-technical audiences. #DINSEYANALYTICS #DISNEYTECH The hiring range for this position in Santa Monica, CA is $114,900 to $154,100 per year and in New York City, NY is $120,300 to $161,300. The base pay actually offered will take into account internal equity and also may vary depending on the candidate's geographic region, job-related knowledge, skills, and experience among other factors. A bonus and/or long-term incentive units may be provided as part of the compensation package, in addition to the full range of medical, financial and/or other benefits, dependent on the level and position offered.",https://www.linkedin.com/jobs/view/4313278900,2025-10-14 02:56:33
4312922442,Data Scientist,Activision,"Job Title Data Scientist Requisition ID R026165 Job Description Your Mission Responsibilities As a Data Scientist, you will develop tools and models within our Decision Tools, which include building scalable products that empower other data scientists and business analysts within our Global Analytics, Game Studios, Finance, and Marketing organizations. You will be responsible for: Building AI, ML, and DS products. Contributing reusable code to internal software libraries, following software engineering best practices. Researching and implementing novel Data Science and Machine Learning approaches, incorporating these solutions into our codebase and products. Translating requirements from cross-disciplinary teams in Game Operations, Marketing, Game Studios, and Business Planning into data solutions. Synthesizing disparate data, detecting and working around broken data, and investigating every possibility until you have a thorough solution. You Will Leverage Your Experience To Steer Data-driven Discussions, Improve Internal Processes, And Communicate Results To Technical And Non-technical Colleagues. You Will Be a Trusted Member Of An Established Team Of Data Scientists And Machine Learning Engineers, Focused On Ensuring Player Satisfaction In Our Games. You Will Accomplish This By Enhancing our A/B testing framework with new methodologies for broader data scientist utilization. Developing and supporting a Propensity ML model factory, incorporating novel time series models leveraging player data. Creating new predictive models, such as for forecasting financial sales. Contributing to a Generative AI-powered anomaly detection product for the analytics team. Being a tenacious and self-directed problem solver. Being team-oriented, and able to build long-lasting and collaborative relationships effectively. Respectfully contributing your professional experience in every conversation. Listening with openness to others. Adapting quickly, having a high tolerance for ambiguity, and coordinating effectively on a team. Player Profile Minimum Requirements BS in Computer Science, Mathematics, Statistics, Data Science, Operations Research, or another quantitative field. 2+ years professional experience as a Data Scientist. Interest in implementing prototype-to-production engineering skills in Python, including best practices such as unit testing, source control, proper documentation, library packaging, versioning, testing, containerization, CI/CD, and task scheduling. General machine learning expertise, i.e. regression, classification, clustering algorithms Professional MLOPs habits around model validation, testing, and tracking. Interest in inferential statistics, e.g. statistical power analysis, significance testing, t-tests. Engineering experience in at least one cloud platform such as AWS, GCP, or Azure. Bonus Points Experience with LLMs and RAG based workflows. Prior experience building software products. Experience with time series ML modeling and Generative AI. Video game enthusiasm with a solid understanding of the gameplay mechanics of first-person shooters. Our World Activision Blizzard, Inc. is the world’s largest interactive entertainment company, with operations across North America, Europe, and Asia. We are home to some of the most beloved entertainment franchises including Call of Duty®, Destiny, Skylanders®, World of Warcraft®, Overwatch®, Diablo®, Candy Crush™, and Bubble Witch™. Our combined entertainment network delights hundreds of millions of monthly active users in 196 countries, making us the largest gaming network on the planet! The video game industry and therefore our business is fast-paced and will continue to evolve. As such, the duties and responsibilities of this role may be changed as directed by the Company at any time to promote and support our business and relationships with industry partners. We’re not just looking back at our decades-long legacy; we’re forging ahead to keep advancing gameplay with some of the most popular titles and sophisticated technology in the world. We have bold ambitions to create the most inclusive company as we know our success comes from the passionate, creative, and diverse teams within our organization. We’re in the business of delivering fun and unforgettable entertainment for our player community to enjoy. And our future opportunities have never been greater — this could be your opportunity to level up. Our ability to build immersive and innovate worlds is only enhanced by diverse teams working in an inclusive environment. We aspire to have a culture where everyone can thrive in order to connect and engage the world through epic entertainment. We provide a suite of benefits that promote physical, emotional and financial well-being for ‘Every World’ - we’ve got our employees covered! The videogame industry and therefore our business is fast-paced and will continue to evolve. As such, the duties and responsibilities of this role may be changed as directed by the Company at any time to promote and support our business and relationships with industry partners. Activision is an Equal Opportunity Employer. All qualified applicants will receive consideration for employment without regard to race, color, religion, sex, sexual orientation, gender identity, gender expression, national origin, protected veteran status, or any other basis protected by applicable law and will not be discriminated against on the basis of disability. Rewards Requirements We provide a suite of benefits that promote physical, emotional and financial well-being for ‘Every World’ - we’ve got our employees covered! Subject to eligibility requirements, the Company offers comprehensive benefits including: Medical, dental, vision, health savings account or health reimbursement account, healthcare spending accounts, dependent care spending accounts, life and AD&D insurance, disability insurance; 401(k) with Company match, tuition reimbursement, charitable donation matching; Paid holidays and vacation, paid sick time, floating holidays, compassion and bereavement leaves, parental leave; Mental health & wellbeing programs, fitness programs, free and discounted games, and a variety of other voluntary benefit programs like supplemental life & disability, legal service, ID protection, rental insurance, and others; If the Company requires that you move geographic locations for the job, then you may also be eligible for relocation assistance. Eligibility to participate in these benefits may vary for part time and temporary full-time employees and interns with the Company. You can learn more by visiting https://www.benefitsforeveryworld.com/. In the U.S., the standard base pay range for this role is $71,300.00 - $131,906.00 Annual. These values reflect the expected base pay range of new hires across all U.S. locations. Ultimately, your specific range and offer will be based on several factors, including relevant experience, performance, and work location. Your Talent Professional can share this role’s range details for your local geography during the hiring process. In addition to a competitive base pay, employees in this role may be eligible for incentive compensation. Incentive compensation is not guaranteed. While we strive to provide competitive offers to successful candidates, new hire compensation is negotiable.",https://www.linkedin.com/jobs/view/4312922442,2025-10-14 02:56:34
4305254605,Data Scientist,Tata Consultancy Services,"Job Description Data Analysis and Exploration: Analyze large, complex datasets to extract meaningful insights and identify trends. Perform exploratory data analysis (EDA) using AWS data processing tools. Model Development: Build, train, and evaluate machine learning models using AWS services such as SageMaker, and frameworks like TensorFlow. ETL and Data Preparation: Work with AWS Glue, Redshift, Textract and other data engineering tools to preprocess, transform, and manage data for machine learning purposes. Machine Learning Pipeline Development: Develop end-to-end machine learning pipelines on AWS to automate and operationalize the deployment of models at scale. Collaboration: Work closely with data engineers, business analysts, and stakeholders to understand business needs and tailor data science solutions to meet those needs. Model Deployment and Monitoring: Deploy models to production and set up monitoring systems to track performance, accuracy, and other key metrics. Use SageMaker and Lambda for model hosting and API development. Documentation and Reporting: Document models, processes, and findings for stakeholders, enabling clear communication of results and decision support. Base Salary Range: $100,000 - $120,000 per annum TCS Employee Benefits Summary Discretionary Annual Incentive. Comprehensive Medical Coverage: Medical & Health, Dental & Vision, Disability Planning & Insurance, Pet Insurance Plans. Family Support: Maternal & Parental Leaves. Insurance Options: Auto & Home Insurance, Identity Theft Protection. Convenience & Professional Growth: Commuter Benefits & Certification & Training Reimbursement. Time Off: Vacation, Time Off, Sick Leave & Holidays. Legal & Financial Assistance: Legal Assistance, 401K Plan, Performance Bonus, College Fund, Student Loan Refinancing. Qualifications: BACHELOR OF COMPUTER SCIENCE",https://www.linkedin.com/jobs/view/4305254605,2025-10-14 02:56:36
4312130617,Machine Learning Engineer,Aspect Software,"Job Title: Machine Learning Engineer About Aspect Software: Aspect Software develops world-class Workforce Engagement Management software that empowers the Employee to reach their highest potential to achieve operational excellence. We are committed to fostering a collaborative and dynamic work environment where cutting-edge technology and creative problem-solving converge. Join us as we shape the future of intelligent workforce systems. Position Overview: We are looking for a skilled and motivated Machine Learning Engineer to join our growing team. In this role, you’ll design, develop, and deploy machine learning models to solve real-world problems—particularly in the Workforce Management domain. You’ll collaborate with data scientists, software engineers, and product managers to deliver scalable, production-ready ML solutions. Key Responsibilities: Design, develop, and optimize machine learning models for business-critical use cases Build reliable data pipelines for data cleaning, feature engineering, and model training Collaborate with cross-functional teams to translate business needs into technical solutions Deploy and maintain ML models in production, ensuring reliability and performance Monitor model performance and implement ongoing improvements Conduct research and stay current on advancements in ML/AI Work with engineering teams to integrate ML models into production systems Maintain clear documentation for processes, tools, and methodologies Qualifications: Bachelor’s or Master’s degree in Computer Science, Data Science, Mathematics, or a related field 2–4 years of hands-on experience developing machine learning models, including production deployment Proficient in Python (preferred), R, or C++ Experience with ML libraries and frameworks (e.g., TensorFlow, PyTorch, Scikit-learn) Solid grasp of data structures, algorithms, and software engineering fundamentals Familiarity with cloud platforms (AWS, Azure, GCP) and container tools (Docker, Kubernetes) Strong problem-solving skills and attention to detail Effective communication and collaboration skills Preferred Skills: Some experience with time series processing, natural language processing (NLP), computer vision, or reinforcement learning Basic knowledge of MLOps practices and tools Familiarity with big data technologies like Hadoop, Spark, or Kafka Experience in developing APIs for model deployment Background in statistical analysis and data visualization Why Join Us? Work on impactful and challenging projects that make a difference Be part of a collaborative and inclusive culture Enjoy competitive compensation and benefits Access professional development and growth opportunities Join a team passionate about innovation and excellence",https://www.linkedin.com/jobs/view/4312130617,2025-10-14 02:56:37
4312986546,"Scientist II, (Multiple positions)",Uber,"About The Role Scientists at Uber use data to analyze, improve and automate all aspects of Uber's core rideshare and delivery products. You will be joining the Rider Pricing and Incentives team, which owns our automated real-time pricing and incentives algorithms and platform. You will work on analyzing data that help design the models that maintain reliability and improve the efficiency of Uber's Mobility marketplace. We are looking for experienced candidates with a passion for analyzing data and solving new and difficult problems with data. In this role, you will be able to use your strong quantitative skills in the fields of economics, machine learning, and/or operations research to improve the Uber rider experience as well as the overall marketplace performance. What The Candidate Will Need / Bonus Points ---- What the Candidate Will Do ---- Use data to understand product performance and to identify improvement opportunities. Build statistical, optimization, and machine learning models for a range of applications in the pricing and incentives algorithms space. Design and execute product experiments and interpret the results to draw detailed and actionable conclusions. Present findings to senior management to inform business decisions. Collaborate with cross-functional teams across disciplines such as product, engineering, operations, and marketing to drive system development end-to-end from ideation to productionization Basic Qualifications Ph.D., M.S., or Bachelors degree in Statistics, Economics, Machine Learning, Operations Research, or other quantitative fields. 2+ years of experience as an Applied or Data Scientist or equivalent (can be also as part of Ph.D training). Knowledge of underlying mathematical foundations of statistics, machine learning, optimization, economics, and analytics. Experience in experimental design and analysis. Experience with exploratory data analysis, statistical analysis and testing, and model development. Ability to use Python to work efficiently at scale with large data sets. Proficiency in SQL. Preferred Qualifications 2+ years of industry experience. Experience in algorithm development and prototyping. Experience in pricing optimization. Experience with productionizing algorithms for real-time systems. Well-honed communication and presentation skills. For New York, NY-based roles: The base salary range for this role is USD$155,000 per year - USD$172,000 per year. For San Francisco, CA-based roles: The base salary range for this role is USD$155,000 per year - USD$172,000 per year. For Seattle, WA-based roles: The base salary range for this role is USD$155,000 per year - USD$172,000 per year. For Sunnyvale, CA-based roles: The base salary range for this role is USD$155,000 per year - USD$172,000 per year. For all US locations, you will be eligible to participate in Uber's bonus program, and may be offered an equity award & other types of comp. You will also be eligible for various benefits. More details can be found at the following link https://www.uber.com/careers/benefits., For New York, NY-based roles: The base salary range for this role is USD$155,000 per year - USD$172,000 per year. For San Francisco, CA-based roles: The base salary range for this role is USD$155,000 per year - USD$172,000 per year. For Seattle, WA-based roles: The base salary range for this role is USD$155,000 per year - USD$172,000 per year. For Sunnyvale, CA-based roles: The base salary range for this role is USD$155,000 per year - USD$172,000 per year. For all US locations, you will be eligible to participate in Uber's bonus program, and may be offered an equity award & other types of comp. You will also be eligible for various benefits. More details can be found at the following link https://www.uber.com/careers/benefits.",https://www.linkedin.com/jobs/view/4312986546,2025-10-14 02:56:38
4302430221,Data Scientist,MillerKnoll,"Why join us? Our purpose is to design for the good of humankind. It’s the ideal we strive toward each day in everything we do. Being a part of MillerKnoll means being a part of something larger than your work team, or even your brand. We are redefining modern for the 21st century. And our success allows MillerKnoll to support causes that align with our values, so we can build a more sustainable, equitable, and beautiful future for everyone. About The Role We’re looking for an experienced and adaptable Data Scientist to join our growing AI & Data Science team. You’ll be part of a small, highly technical group focused on delivering impactful machine learning, forecasting, and generative AI solutions. In this role, you’ll work closely with stakeholders to translate business challenges into well-defined analytical problems, design and validate models, and communicate results in clear, actionable terms. You’ll collaborate extensively with our ML Engineer to transition solutions from experimentation to production, ensuring models are both effective and robust in real-world environments. You’ll be expected to quickly prototype and iterate on solutions, adapt to new tools and approaches, and share knowledge with the broader organization. This is a hands-on role with real impact and room to innovate. Key Responsibilities Partner with business stakeholders to identify, scope, and prioritize data science opportunities. Translate complex business problems into structured analytical tasks and hypotheses. Design, develop, and evaluate machine learning, forecasting, and statistical models, considering fairness, interpretability, and business impact. Perform exploratory data analysis, feature engineering, and data preprocessing. Rapidly prototype solutions to assess feasibility before scaling. Interpret model outputs and clearly communicate findings, implications, and recommendations to both technical and non-technical audiences. Collaborate closely with the ML Engineer to transition models from experimentation into scalable, production-ready systems. Develop reproducible code, clear documentation, and reusable analytical workflows to support org-wide AI adoption. Stay up to date with advances in data science, AI/ML, and generative AI, bringing innovative approaches to the team. Required Technical Skills Bachelor’s or Master’s degree in Data Science, Statistics, Applied Mathematics, Computer Science, or a related quantitative field, with 3+ years of applied experience in data science. Strong foundation in statistics, probability, linear algebra, and optimization. Proficiency with Python and common data science libraries (Pandas, NumPy, Scikit-learn, XGBoost, PyTorch or TensorFlow). Experience with time series forecasting, regression, classification, clustering, or recommendation systems. Familiarity with GenAI concepts and tools (LLM APIs, embeddings, prompt engineering, evaluation methods). Strong SQL skills and experience working with large datasets and cloud-based data warehouses (Snowflake, BigQuery, etc.). Solid understanding of experimental design and model evaluation metrics beyond accuracy. Experience with data visualization and storytelling tools (Plotly, Tableau, Power BI, or Streamlit). Exposure to MLOps/LLMOps concepts and working in close collaboration with engineering teams. Soft Skills & Qualities Excellent communication skills with the ability to translate analysis into actionable business recommendations. Strong problem-solving abilities and business acumen. High adaptability to evolving tools, frameworks, and industry practices. Curiosity and continuous learning mindset. Stakeholder empathy and ability to build trust while introducing AI solutions. Strong collaboration skills and comfort working in ambiguous, fast-paced environments. Commitment to clear documentation and knowledge sharing. Who We Hire? Simply put, we hire qualified applicants representing a wide range of backgrounds and abilities. MillerKnoll is comprised of people of all abilities, gender identities and expressions, ages, ethnicities, sexual orientations, veterans from every branch of military service, and more. Here, you can bring your whole self to work. We’re committed to equal opportunity employment, including veterans and people with disabilities. This organization participates in E-Verify Employment Eligibility Verification. In general, MillerKnoll positions are closed within 45 days and are open for applications for a minimum of 5 days. We encourage our prospective candidates to submit their application(s) expediently so as not to miss out on our opportunities. We frequently post new opportunities and encourage prospective candidates to check back often for new postings. MillerKnoll complies with applicable disability laws and makes reasonable accommodations for applicants and employees with disabilities. If reasonable accommodation is needed to participate in the job application or interview process, to perform essential job functions, and/or to receive other benefits and privileges of employment, please contact MillerKnoll Talent Acquisition at careers_help@millerknoll.com.",https://www.linkedin.com/jobs/view/4302430221,2025-10-14 02:56:40
