job_id,title,company,description,url,fetched_at
4209153448,Data Scientist,Two Sigma,"Position Summary Two Sigma is a financial sciences company, combining data analysis, invention, and rigorous inquiry to help solve the toughest challenges in investment management, securities, private equity, and venture capital. Our team of scientists, technologists, and academics looks beyond the traditional to develop creative solutions to some of the world’s most complex economic problems. When you work with us, you tackle tough problems alongside other scientists and engineers. People who will challenge your ideas. Who you can really learn from, and collaborate with. And you’ll be doing work that matters to a lot of people, too. Our investors include some of the world’s largest retirement funds, research institutions, educational endowments, healthcare systems and foundations. We admire what they do, and we’re proud to serve these organizations. You Will Take On The Following Responsibilities Independently research and develop hypotheses based on diverse and unique real-world datasets. Conduct literature reviews to develop and apply cutting-edge methodologies for extracting meaningful signals from our vast data holdings. Partner with our engineers and business stakeholders to rigorously explore and test your theories. All the while, you’ll remain engaged in the academic community. As examples, you can: Join our reading circles to stay up to date on the latest research papers in your fields Attend academic seminars to learn from thought leaders from top universities You Should Possess The Following Qualifications 1-5+ years of experience in applied data analysis & prediction, preferably in an industry setting Degree in a technical or quantitative disciplines, like statistics, mathematics, physics, electrical engineering, or computer science Proficient in Python and SQL Performed an in-depth research project, examining real-world data Are an independent thinker who can creatively approach data analysis and communicate complex ideas clearly You don’t need a background in finance. It’s nice to have, but more than half of Two Sigma’s employees come from outside the finance industry. If you’ve got the research skills, we can teach you the financial aspects of the job. You Will Enjoy The Following Benefits Core Benefits: Fully paid medical and dental insurance premiums for employees and dependents, competitive 401k match, employer-paid life & disability insurance Perks: Onsite gyms with laundry service, wellness activities, casual dress, snacks, game rooms Learning: Tuition reimbursement, conference and training sponsorship Time Off: Generous vacation and unlimited sick days, competitive paid caregiver leaves Hybrid Work Policy: Flexible in-office days with budget for home office setup The base pay for this role will be between $165,000 and $300,000. This role may also be eligible for other forms of compensation and benefits, such as a discretionary bonus, health, dental and other wellness plans and 401(k) contributions. Discretionary bonus can be a significant portion of total compensation. Actual compensation for successful candidates will be carefully determined based on a number of factors, including their skills, qualifications and experience. We are proud to be an equal opportunity workplace. We do not discriminate based upon race, religion, color, national origin, sex, sexual orientation, gender identity/expression, age, status as a protected veteran, status as an individual with a disability, or any other applicable legally protected characteristics. Two Sigma is committed to providing reasonable accommodations to qualified individuals in accordance with applicable federal, state, and local laws. If you believe you need an accommodation, please visit our website for additional information.",https://www.linkedin.com/jobs/view/4209153448,2025-10-14 02:56:14
4289849219,Data Scientist,Meta,"Meta is seeking a highly skilled Data Scientist to join our Infrastructure Data Centers team. As a lead data scientist, you will partner with stakeholders, program managers, and other data science functions to translate Meta’s Infrastructure Data Centers’ data into value. You will have the opportunity to work on a wide range of data science projects, such as developing an analytics program to drive operational efficiency, conducting strategic analysis to facilitate decision making, measuring Machine Learning models and automation to increase predictive accuracy and reduce manual effort, and working with software developers to build analytic solutions.You will have experience with working in ambiguous environment and creating impact from the ground up in a fast-paced environment. Additionally, you will have a proven track record of thought leadership and impact in developing similar analytics programs and machine learning solutions. This position is part of the Infrastructure Data Centers organization. Data Scientist Responsibilities: Collaborate with cross-functional data and business teams to define problems, analyze impacts, identify opportunities, and develop solutions that improve decision-making and efficiency Translate business challenges into data-driven problems and design appropriate data science solutions, including metrics and analytics, business intelligence, experimentation Identify operational gaps, build analytical models to derive insights, and support decision-making across organizational leadership Design and implement statistical models such as hypothesis testing, forecasting, statistical process control, and simulation to influence critical business decisions and Data Center operations Utilize expertise in statistics, machine learning, optimization, and automation to develop analytics solutions Work closely with stakeholders, data engineers, and program/product managers to ensure a seamless progress Educate and influence stakeholders to enhance operational efficiency with empathy Recommend process improvements based on operational data and user behavior to boost business performance Minimum Qualifications: Currently has, or is in the process of obtaining a Bachelor's degree in Computer Science, Computer Engineering, relevant technical field, or equivalent practical experience. Degree must be completed prior to joining Meta Bachelor's degree in Computer Science, Computer Engineering, relevant technical field, or equivalent practical experience 4+ years of experience (1+ years of experience post Ph.D.) managing and analyzing large-scale data using Python, R, or similar languages 4+ years of experience (1+ years of experience post Ph.D.) working with visualization tools such as Tableau, PowerBI, or similar 4+ years experience (1+ years of experience post Ph.D.) analyzing and interpreting data, developing metrics, drawing conclusions, recommending actions, and reporting results across stakeholders 4+ years of experience (1+ years of experience post Ph.D.) with advanced SQL in big data environments (e.g., Hive, Presto, Spark) and data modeling Experience in enhancing data collection procedures, data processing, cleansing, and verifying the integrity of data used for analysis Proven track record of managing and leading cross-functional projects and teams Solid understanding of machine learning techniques and algorithms Hands-on programming experience in one or more of: AI/ML, LLM, NLP, Statistical modeling Proficient in statistical analysis and experimental design Preferred Qualifications: Technical knowledge of data center operations Masters degree in Computer Science, Engineering, Mathematics, Statistics, Operations Research, or a related analytical field Knowledge of simulation and optimization techniques Communication and storytelling skills to influence all organizational levels (engineers, executives and cross functional teams) to drive business decisions About Meta: Meta builds technologies that help people connect, find communities, and grow businesses. When Facebook launched in 2004, it changed the way people connect. Apps like Messenger, Instagram and WhatsApp further empowered billions around the world. Now, Meta is moving beyond 2D screens toward immersive experiences like augmented and virtual reality to help build the next evolution in social technology. People who choose to build their careers by building with us at Meta help shape a future that will take us beyond what digital connection makes possible today—beyond the constraints of screens, the limits of distance, and even the rules of physics. Meta is proud to be an Equal Employment Opportunity and Affirmative Action employer. We do not discriminate based upon race, religion, color, national origin, sex (including pregnancy, childbirth, or related medical conditions), sexual orientation, gender, gender identity, gender expression, transgender status, sexual stereotypes, age, status as a protected veteran, status as an individual with a disability, or other applicable legally protected characteristics. We also consider qualified applicants with criminal histories, consistent with applicable federal, state and local law. Meta participates in the E-Verify program in certain locations, as required by law. Please note that Meta may leverage artificial intelligence and machine learning technologies in connection with applications for employment. Meta is committed to providing reasonable accommodations for candidates with disabilities in our recruiting process. If you need any assistance or accommodations due to a disability, please let us know at accommodations-ext@fb.com. $114,000/year to $171,000/year + bonus + equity + benefits Individual compensation is determined by skills, qualifications, experience, and location. Compensation details listed in this posting reflect the base hourly rate, monthly rate, or annual salary only, and do not include bonus, equity or sales incentives, if applicable. In addition to base compensation, Meta offers benefits. Learn more about benefits at Meta.",https://www.linkedin.com/jobs/view/4289849219,2025-10-14 02:56:15
4314178327,Data Scientist (Remote),EBLA JEWELS,"Exciting Career Opportunity - Join Our Team! We are looking for dedicated and motivated individuals to join our team and contribute to our continued success. This position offers a chance to grow professionally in a supportive and inclusive environment, with flexibility and long-term career potential. Employment Type: Full-Time / Part-Time Salary Range: $35-40/hr Job Summary The ideal candidate will perform a range of tasks to support daily operations, contribute to team goals, and uphold our standards of excellence. This role requires a proactive attitude, a willingness to learn, and a commitment to quality and professionalism. Key Responsibilities Support day-to-day operations and team functions Maintain accuracy and attention to detail in assigned tasks Communicate effectively with team members and clients Adhere to company policies, procedures, and deadlines Take initiative and show flexibility in handling tasks Contribute to a positive and respectful work culture Qualifications High school diploma or equivalent (college degree a plus) Basic computer and communication skills Strong organizational and time management abilities Ability to work independently or as part of a team Adaptable and willing to learn new tools or systems Reliable and responsible work ethic Benefits Competitive salary with opportunities for increases Flexible work hours and remote options (if applicable) Opportunities for career growth and advancement Ongoing training and development Health, dental, and vision insurance (if applicable) Paid time off and holiday benefits Employee support programs and recognition Take the next step in your career and apply today. We are excited to learn more about you!",https://www.linkedin.com/jobs/view/4314178327,2025-10-14 02:56:17
4312854796,Data Scientist,DTE Energy,"Job Summary Responsible for translating business requirements into analytical constructs and using data to propose solutions for effective decision making. Collects, validates, transforms, and cleanses data, as well as performs quantitative analysis to derive insights. Runs analytical experiments in a methodical manner and regularly evaluates alternative models and techniques. Develops predictive models to forecast business performance metrics and provides recommendations for strategic decisions. Responsible for teaching others the tools, techniques and best practices in self-service reporting, data analysis and predictive analytics. Key Accountabilities Performs in-depth analyses (e.g., cost-benefit, invest-divest, forecasting, predictive, what-if, impact analysis, etc.) to help the company focus on key decisions to improve safety, employee engagement, operational efficiency, product quality, and customer satisfaction Develops, modifies, and automates reports, builds and prototypes dashboards to provide insights, and provides analytical solutions Responsible for discovering insights from Big Data to help shape or meet specific business needs and goals. Develops and maintains analytical models through understanding data, evaluating technologies, optimizing algorithms, experimenting and validating models Delivers effective presentations that tell compelling stories about analytical insights Performs data cleansing and blending processes to produce analytic data sets for use by a variety of downstream purposes Implements new statistical, mathematical, machine learning or other methodologies for modeling or analysis Utilizes business knowledge to translate goals into data-based deliverables, such as predictive models, pattern detection analysis or optimization algorithms Trains and enables self-service reporting capability and use of Business Intelligence tools for supported business unit(s) Conducts research to identify relevant data for developing prototypes and proof-of-concepts Collaborates with cross-functional stakeholders to understand business needs, formulate complete end-to-end analyses that includes business requirements, data gathering, analysis, scaleable solutions, and presentations Minimum Education & Experience Requirements This is a dual-track base requirement job; education and experience requirements can be satisfied through one of the following two options: Bachelor’s degree with emphasis on coursework of a quantitative nature (e.g., Statistics, Computer Science, Engineering, Mathematics, Physics, Data Science, Industrial/Organizational Psychology and Econometrics, etc.) and 3 years of experience working in a data analytical or computer programming function; or Master’s degree with emphasis on coursework of a quantitative nature (e.g., Statistics, Computer Science, Engineering, Mathematics, Physics, Data Science, Industrial/Organizational Psychology and Econometrics, etc.) and 1 year of experience working in a data analytical or computer programming function Preferred Other Qualifications Master’s or PhD degree in Data Science Experience in quantitative analytics (e.g. data mining, regression analysis, hypothesis testing, predictive modeling techniques, and model optimization) Knowledge and intermediate-level skills in data modeling, data structure, and the application of complex SQL queries with data from multiple sources, including Big Data platform (e.g., Hadoop, AWS, Azure) Familiarity with Cloud environments Experience with SAP Business Intelligence tools and SAP CRM, ISU, and BW data Familiarity with Continuous Improvement concepts and applications (e.g., six sigma, lan) Strong written and verbal communication skills Utility/energy or customer-oriented industry experience Other Requirements Intermediate-level experience with data mining and statistical analysis using analytical packages/tools (e.g., R, SAS, SPSS, Stata, MATLAB, Minitab, etc.) Intermediate-level experience in articulating business questions, pulling data from relational databases (e.g., SAP BW, ORACLE, SQL SERVER) and using advanced excel and statistical tools (e.g., Minitab, Alteryx, Advanced Excel with VBA, R, Python, SAS, SPSS, Stata, MATLAB, etc.) to conduct in-depth analysis to support decision making Intermediate-level proficiency in business intelligence tools (e.g., Microsoft PowerBI, Tableau, SAP, Business Objects (BOBJ), etc.) Intermediate-level programming skills in SQL, C/C++/C#, PHP, Java, Python, R, ASP, or SAS Understanding of applied research design and machine learning (e.g. multivariate statistical analysis, unsupervised and supervised learning, predictive modeling) Self-starter and quick learner; advances self and others' knowledge and skill sets in business processes, data science, new analytical frameworks, technologies, and applications Interpersonal, analytical and problem-solving skills, including ability to communicate technical information and complex data analytics to a non-technical audience Additional Information Incumbents may engage in all or some combination of the activities and accountabilities, and utilize a variety of the competencies cited in this description depending upon the organization and role to which they are assigned. This description is intended to describe the general nature and level of work performed by incumbents in this job. It is not intended as an all-inclusive list of accountabilities or responsibilities, nor is it intended to limit the rights of supervisors or management representatives to assign, direct and control the work of employees under their supervision.",https://www.linkedin.com/jobs/view/4312854796,2025-10-14 02:56:18
4301494328,"Data Scientist, Product Analytics",Meta,"As a Data Scientist at Meta, you will shape the future of people-facing and business-facing products we build across our entire family of applications (Facebook, Instagram, Messenger, WhatsApp, Oculus). By applying your technical skills, analytical mindset, and product intuition to one of the richest data sets in the world, you will help define the experiences we build for billions of people and hundreds of millions of businesses around the world. You will collaborate on a wide array of product and business problems with a wide-range of cross-functional partners across Product, Engineering, Research, Data Engineering, Marketing, Sales, Finance and others. You will use data and analysis to identify and solve product development's biggest challenges. You will influence product strategy and investment decisions with data, be focused on impact, and collaborate with other teams. By joining Meta, you will become part of a world-class analytics community dedicated to skill development and career growth in analytics and beyond.Product leadership: You will use data to shape product development, quantify new opportunities, identify upcoming challenges, and ensure the products we build bring value to people, businesses, and Meta. You will help your partner teams prioritize what to build, set goals, and understand their product's ecosystem.Analytics: You will guide teams using data and insights. You will focus on developing hypotheses and employ a varied toolkit of rigorous analytical approaches, different methodologies, frameworks, and technical approaches to test them.Communication and influence: You won't simply present data, but tell data-driven stories. You will convince and influence your partners using clear insights and recommendations. You will build credibility through structure and clarity, and be a trusted strategic partner. Data Scientist, Product Analytics Responsibilities: Work with large and complex data sets to solve a wide array of challenging problems using different analytical and statistical approaches Apply technical expertise with quantitative analysis, experimentation, data mining, and the presentation of data to develop strategies for our products that serve billions of people and hundreds of millions of businesses Identify and measure success of product efforts through goal setting, forecasting, and monitoring of key product metrics to understand trends Define, understand, and test opportunities and levers to improve the product, and drive roadmaps through your insights and recommendations Partner with Product, Engineering, and cross-functional teams to inform, influence, support, and execute product strategy and investment decisions Minimum Qualifications: Currently has, or is in the process of obtaining a Bachelor's degree in Computer Science, Computer Engineering, relevant technical field, or equivalent practical experience. Degree must be completed prior to joining Meta Bachelor's degree in Mathematics, Statistics, a relevant technical field, or equivalent 2+ years of work experience in analytics and data querying languages (e.g. SQL), scripting languages (e.g. Python), and/or statistical/mathematical software (e.g. R) 2+ years of experience solving analytical problems using quantitative approaches, understanding ecosystems, user behaviors & long-term product trends, and leading data-driven projects from definition to execution [including defining metrics, experiment, design, communicating actionable insights] Preferred Qualifications: Master's or Ph.D. Degree in a quantitative field About Meta: Meta builds technologies that help people connect, find communities, and grow businesses. When Facebook launched in 2004, it changed the way people connect. Apps like Messenger, Instagram and WhatsApp further empowered billions around the world. Now, Meta is moving beyond 2D screens toward immersive experiences like augmented and virtual reality to help build the next evolution in social technology. People who choose to build their careers by building with us at Meta help shape a future that will take us beyond what digital connection makes possible today—beyond the constraints of screens, the limits of distance, and even the rules of physics. Meta is proud to be an Equal Employment Opportunity and Affirmative Action employer. We do not discriminate based upon race, religion, color, national origin, sex (including pregnancy, childbirth, or related medical conditions), sexual orientation, gender, gender identity, gender expression, transgender status, sexual stereotypes, age, status as a protected veteran, status as an individual with a disability, or other applicable legally protected characteristics. We also consider qualified applicants with criminal histories, consistent with applicable federal, state and local law. Meta participates in the E-Verify program in certain locations, as required by law. Please note that Meta may leverage artificial intelligence and machine learning technologies in connection with applications for employment. Meta is committed to providing reasonable accommodations for candidates with disabilities in our recruiting process. If you need any assistance or accommodations due to a disability, please let us know at accommodations-ext@fb.com. $114,000/year to $171,000/year + bonus + equity + benefits Individual compensation is determined by skills, qualifications, experience, and location. Compensation details listed in this posting reflect the base hourly rate, monthly rate, or annual salary only, and do not include bonus, equity or sales incentives, if applicable. In addition to base compensation, Meta offers benefits. Learn more about benefits at Meta.",https://www.linkedin.com/jobs/view/4301494328,2025-10-14 02:56:20
